{
  "$schema": "https://json-schema.org/draft/2020-12/schema",
  "title": "Willowbrook Book",
  "type": "object",
  "required": [
    "circle",
    "circleIcon",
    "bookId",
    "title",
    "cover",
    "cast",
    "toc",
    "chapters",
    "quiz"
  ],
  "additionalProperties": false,
  "properties": {
    "circle": {
      "type": "string"
    },
    "circleIcon": {
      "type": "string"
    },
    "bookId": {
      "type": "string",
      "pattern": "^[a-z]+-[0-9]{3}$"
    },
    "title": {
      "type": "string"
    },
    "subtitle": {
      "type": "string"
    },
    "cover": {
      "type": "object",
      "required": [
        "image",
        "alt"
      ],
      "additionalProperties": false,
      "properties": {
        "image": {
          "type": "string"
        },
        "alt": {
          "type": "string"
        }
      }
    },
    "cast": {
      "type": "array",
      "minItems": 1,
      "items": {
        "type": "string"
      },
      "description": "Character ids (keys of docs/character-bios.json) who appear, in order of appearance."
    },
    "toc": {
      "type": "array",
      "minItems": 1,
      "items": {
        "type": "object",
        "required": [
          "type",
          "label"
        ],
        "additionalProperties": false,
        "properties": {
          "type": {
            "type": "string",
            "enum": [
              "title",
              "chapter"
            ]
          },
          "label": {
            "type": "string"
          },
          "anchor": {
            "type": "string"
          }
        }
      }
    },
    "chapters": {
      "type": "array",
      "minItems": 1,
      "items": {
        "type": "object",
        "required": [
          "id",
          "title",
          "pages"
        ],
        "additionalProperties": false,
        "properties": {
          "id": {
            "type": "string"
          },
          "title": {
            "type": "string"
          },
          "pages": {
            "type": "array",
            "minItems": 1,
            "items": {
              "type": "object",
              "required": [
                "number",
                "layout",
                "text",
                "media"
              ],
              "additionalProperties": false,
              "properties": {
                "number": {
                  "type": "integer",
                  "minimum": 1
                },
                "layout": {
                  "type": "string",
                  "enum": [
                    "art-left",
                    "art-right",
                    "art-full"
                  ]
                },
                "text": {
                  "type": "array",
                  "minItems": 1,
                  "items": {
                    "type": "string"
                  }
                },
                "media": {
                  "type": "array",
                  "minItems": 1,
                  "items": {
                    "type": "object",
                    "required": [
                      "type",
                      "src",
                      "alt"
                    ],
                    "additionalProperties": false,
                    "properties": {
                      "type": {
                        "type": "string",
                        "enum": [
                          "image"
                        ]
                      },
                      "src": {
                        "type": "string"
                      },
                      "alt": {
                        "type": "string"
                      },
                      "animation": {
                        "type": "object",
                        "required": [
                          "kind",
                          "trigger"
                        ],
                        "additionalProperties": false,
                        "properties": {
                          "kind": {
                            "type": "string",
                            "enum": [
                              "pulse",
                              "float",
                              "wiggle",
                              "roll"
                            ]
                          },
                          "trigger": {
                            "type": "string",
                            "enum": [
                              "tap",
                              "auto"
                            ]
                          }
                        }
                      }
                    }
                  }
                }
              }
            }
          }
        }
      }
    },
    "quiz": {
      "type": "object",
      "required": [
        "instructions",
        "questions"
      ],
      "additionalProperties": false,
      "properties": {
        "instructions": {
          "type": "string"
        },
        "questions": {
          "type": "array",
          "minItems": 3,
          "items": {
            "type": "object",
            "required": [
              "id",
              "type",
              "prompt",
              "choices",
              "reactions"
            ],
            "additionalProperties": false,
            "properties": {
              "id": {
                "type": "string"
              },
              "type": {
                "type": "string",
                "enum": [
                  "recall",
                  "think"
                ]
              },
              "prompt": {
                "type": "string"
              },
              "choices": {
                "type": "array",
                "minItems": 2,
                "maxItems": 4,
                "items": {
                  "type": "string"
                }
              },
              "answerIndex": {
                "type": "integer",
                "minimum": 0,
                "description": "Required for recall questions; think questions accept every choice."
              },
              "reactions": {
                "type": "object",
                "additionalProperties": false,
                "required": [
                  "correct",
                  "tryAgain"
                ],
                "properties": {
                  "correct": {
                    "type": "object",
                    "required": [
                      "character",
                      "line"
                    ],
                    "additionalProperties": false,
                    "properties": {
                      "character": {
                        "type": "string"
                      },
                      "line": {
                        "type": "string"
                      }
                    }
                  },
                  "tryAgain": {
                    "type": "object",
                    "required": [
                      "character",
                      "line"
                    ],
                    "additionalProperties": false,
                    "properties": {
                      "character": {
                        "type": "string"
                      },
                      "line": {
                        "type": "string"
                      }
                    }
                  }
                }
              }
            }
          }
        }
      }
    }
  }
}
