{
  "circle": "Acorn",
  "circleIcon": "images/web/circles/circle-acorn.webp",
  "bookId": "acorn-003",
  "title": "Which One Is Which?",
  "subtitle": "A Willowbrook Hollow story",
  "cover": {
    "image": "books/acorn-003/images/cover.webp",
    "alt": "Brindle and Leo under the big oak tree, with the mouse twins between them, one gray with dust and one with a leaf on her ear"
  },
  "cast": [
    "pip-pebble",
    "brindle",
    "leo",
    "wren",
    "tansy",
    "moss",
    "zoe"
  ],
  "toc": [
    {
      "type": "title",
      "label": "Title Page"
    },
    {
      "type": "chapter",
      "label": "Chapter 1: Pip or Pebble?",
      "anchor": "ch1"
    },
    {
      "type": "chapter",
      "label": "Chapter 2: The Nap Spot",
      "anchor": "ch2"
    },
    {
      "type": "chapter",
      "label": "Chapter 3: The Twin Trick",
      "anchor": "ch3"
    },
    {
      "type": "chapter",
      "label": "Chapter 4: Mixed Up",
      "anchor": "ch4"
    },
    {
      "type": "chapter",
      "label": "Chapter 5: Which One Is Which?",
      "anchor": "ch5"
    }
  ],
  "chapters": [
    {
      "id": "ch1",
      "title": "Chapter 1: Pip or Pebble?",
      "pages": [
        {
          "number": 1,
          "layout": "art-left",
          "text": [
            "Pip and Pebble were mouse twins. They lived in a hollow log by the stream.",
            "They had the same round ears. They had the same pink tails. They had the same quick little paws.",
            "And they did not agree on one thing. Not one.",
            "Pip said the sky was blue. Pebble said it was more of a gray. They argued until lunch."
          ],
          "media": [
            {
              "type": "image",
              "src": "books/acorn-003/images/page-01.webp",
              "alt": "Pip and Pebble, the mouse twins, stand nose to nose by their hollow log at the stream"
            }
          ]
        },
        {
          "number": 2,
          "layout": "art-right",
          "text": [
            "The twins had one big problem. No one could tell them apart.",
            "“Good morning, Pip!” sang Wren.",
            "“I am Pebble,” said Pebble.",
            "“Good morning, Pebble!” sang Wren to the other twin.",
            "“I am Pip,” said Pip.",
            "Wren flew off in a huff. Twins were too hard. News was more fun."
          ],
          "media": [
            {
              "type": "image",
              "src": "books/acorn-003/images/page-02.webp",
              "alt": "Wren flies off in a huff while the twins stand side by side"
            }
          ]
        },
        {
          "number": 3,
          "layout": "art-left",
          "text": [
            "Tansy did not know which was which. So she just called them both “Pip-Pebble.”",
            "Moss did not know which was which. He just waved at the log.",
            "“Hi, twins,” said Moss. “Hi to both of you. Or just one of you. Hi.”",
            "Then he rolled into a ball, just to be safe."
          ],
          "media": [
            {
              "type": "image",
              "src": "books/acorn-003/images/page-03.webp",
              "alt": "Tansy scratches her head at the twins while Moss peeks out of his ball"
            }
          ]
        },
        {
          "number": 4,
          "layout": "art-right",
          "text": [
            "“It is not fair,” said Pip. “I am the older twin!”",
            "“By one minute,” said Pebble. “And I am the smarter twin.”",
            "“By zero minutes,” said Pip.",
            "They argued about that until the moon came up. But no one in the Hollow was there to hear it."
          ],
          "media": [
            {
              "type": "image",
              "src": "books/acorn-003/images/page-04.webp",
              "alt": "The twins argue by their log under the first stars of the evening"
            }
          ]
        }
      ]
    },
    {
      "id": "ch2",
      "title": "Chapter 2: The Nap Spot",
      "pages": [
        {
          "number": 5,
          "layout": "art-left",
          "text": [
            "The best nap spot was under the big oak tree. It was soft. It was warm. The sun hit it all day.",
            "Brindle the old dog had napped there for ten summers.",
            "Leo the lion had napped there for two.",
            "They liked to share it. Brindle slept on one side. Leo slept on the other side. They were old pals."
          ],
          "media": [
            {
              "type": "image",
              "src": "books/acorn-003/images/page-05.webp",
              "alt": "Brindle and Leo nap side by side in the sunny spot under the big oak tree"
            }
          ]
        },
        {
          "number": 6,
          "layout": "art-right",
          "text": [
            "Then one day, Leo rolled over in his sleep. His big, fluffy mane went FLOMP, onto Brindle.",
            "Brindle woke up with a mouth full of fur.",
            "“PTOO!” said Brindle.",
            "“Sorry,” said Leo. “My mane has a mind of its own.”",
            "“Then your mane can nap on the hill,” said Brindle. “An old dog needs his sleep.”"
          ],
          "media": [
            {
              "type": "image",
              "src": "books/acorn-003/images/page-06.webp",
              "alt": "Leo rolls over in his sleep and his big mane lands on Brindle with a FLOMP"
            }
          ]
        },
        {
          "number": 7,
          "layout": "art-left",
          "text": [
            "So Brindle took his naps by the stream. Leo took his naps up on the hill.",
            "They did not share. They did not talk. They did not even wave.",
            "Brindle could not sleep. The stream was too wet.",
            "Leo could not sleep. The hill was too windy.",
            "Leo’s wish ball sat in the grass. It was dim and gray."
          ],
          "media": [
            {
              "type": "image",
              "src": "books/acorn-003/images/page-07.webp",
              "alt": "Brindle naps alone by the wet stream while Leo sulks up on the windy hill"
            }
          ]
        },
        {
          "number": 8,
          "layout": "art-right",
          "text": [
            "Pip was Brindle’s helper. At nap time, he kept Brindle’s green bandana safe in his log.",
            "Pebble was Leo’s helper. Each day, she brushed the burrs out of his mane.",
            "“Brindle misses Leo,” said Pip.",
            "“Leo misses Brindle,” said Pebble.",
            "For once, the twins agreed."
          ],
          "media": [
            {
              "type": "image",
              "src": "books/acorn-003/images/page-08.webp",
              "alt": "Pip helps Brindle by the stream while Pebble helps Leo on the hill"
            }
          ]
        }
      ]
    },
    {
      "id": "ch3",
      "title": "Chapter 3: The Twin Trick",
      "pages": [
        {
          "number": 9,
          "layout": "art-left",
          "text": [
            "“They just need to talk,” said Pip.",
            "“But Brindle will not go up the hill,” said Pebble.",
            "“And Leo will not go down to the stream,” said Pip.",
            "The twins sat on their log. They had to think. They sat and sat.",
            "Then Pebble’s ears went up. “No one can tell us apart,” she said. “So let’s swap!”"
          ],
          "media": [
            {
              "type": "image",
              "src": "books/acorn-003/images/page-09.webp",
              "alt": "The twins sit on their log and think hard"
            }
          ]
        },
        {
          "number": 10,
          "layout": "art-right",
          "text": [
            "Here was the plan. Pip would go to Leo and act like Pebble. Pebble would go to Brindle and act like Pip.",
            "Each twin had one job. “Come to the oak tree at dusk,” they would say. “There is a surprise.”",
            "“And the surprise is each other!” said Pip.",
            "It was the best plan they ever had. They did not even argue about it. Much."
          ],
          "media": [
            {
              "type": "image",
              "src": "books/acorn-003/images/page-10.webp",
              "alt": "The twins make their plan by the log, with paw prints going two ways"
            }
          ]
        },
        {
          "number": 11,
          "layout": "art-left",
          "text": [
            "There was just one snag. The twins did not look quite the same.",
            "So Pip rolled in the dust by the path. He rolled and rolled. When he got up, he was as gray as a stone.",
            "Pebble had a tiny notch in the top of one ear. So she put a leaf on her ear, like a hat. She held it on with string from her bag of scraps.",
            "Now they looked the same. Well, almost."
          ],
          "media": [
            {
              "type": "image",
              "src": "books/acorn-003/images/page-11.webp",
              "alt": "Pip rolls in a pile of dust and turns gray, and Pebble ties a leaf over her ear"
            }
          ]
        },
        {
          "number": 12,
          "layout": "art-right",
          "text": [
            "Tansy ran by with a nut. She stopped.",
            "“Hi, Pip-Pebble,” said Tansy. “Hi, other Pip-Pebble. Why is there a leaf on your ear?”",
            "“It is a hat,” said Pebble.",
            "“It is a nice hat,” said Tansy. Then she ran off to hide her nut.",
            "Then she forgot where she hid it. Tansy was good at hiding nuts. Finding them, not so much."
          ],
          "media": [
            {
              "type": "image",
              "src": "books/acorn-003/images/page-12.webp",
              "alt": "Tansy stops with a nut and stares at the leaf on Pebble’s ear"
            }
          ]
        }
      ]
    },
    {
      "id": "ch4",
      "title": "Chapter 4: Mixed Up",
      "pages": [
        {